{
    "name": "System preset: Generic KindleFire",
    "description": "Generic transcoding preset for Kindle Fire",
    "size": "1024x576",
    "frame_rate": 30,
    "video_bitrate": "1600k",
    "audio_bitrate": "160k",
    "video_codec": "libx264",
    "audio_codec": "libfdk_aac",
    "video_codec_options": "MaxReferenceFrames:3,Profile:main,Level:3.1"
}
