{
    "name": "System preset: Generic iphone4S",
    "description": "Generic transcoding preset for: iPhone 4s and above, iPad 3G and above, iPad mini, Samsung Galaxy S2/S3/Tab 2",
    "size": "1920x1080",
    "frame_rate": 30,
    "video_bitrate": "5000k",
    "audio_bitrate": "160k",
    "video_codec": "libx264",
    "audio_codec": "libfdk_aac",
    "video_codec_options": "MaxReferenceFrames:3,Profile:high,Level:4.1"
}
