{
    "name": "System preset: Generic KindleFireHD8.9",
    "description": "Generic transcoding preset for Kindle Fire HD 8.9",
    "size": "1920x1080",
    "frame_rate": 30,
    "video_bitrate": "5400k",
    "audio_bitrate": "160k",
    "video_codec": "libx264",
    "audio_codec": "libfdk_aac",
    "video_codec_options": "MaxReferenceFrames:3,Profile:main,Level:4"
}
