{
    "name": "System preset: Generic iphone3GS",
    "description": "Generic transcoding preset for: iPhone 3GS",
    "size": "640x480",
    "frame_rate": 30,
    "video_bitrate": "600k",
    "audio_bitrate": "128k",
    "video_codec": "libx264",
    "audio_codec": "libfdk_aac",
    "video_codec_options": "MaxReferenceFrames:3,Profile:baseline,Level:3"
}
