{
    "name": "System preset: Generic 720p",
    "description": "Generic 720p transcoding preset",
    "size": "1280x720",
    "frame_rate": 29.97,
    "video_bitrate": "2400k",
    "audio_bitrate": "160k",
    "video_codec": "libx264",
    "audio_codec": "libfdk_aac",
    "video_codec_options": "MaxReferenceFrames:3,Profile:baseline,Level:3.1"
}
