{
    "name": "System preset: Generic Apple TV 2G",
    "description": "Generic transcoding preset for Apple TV 2G",
    "size": "1280x720",
    "frame_rate": 30,
    "video_bitrate": "5000k",
    "audio_bitrate": "160k",
    "video_codec": "libx264",
    "audio_codec": "libfdk_aac",
    "video_codec_options": "MaxReferenceFrames:3,Profile:main,Level:3.1"
}
