{
    "name": "System preset: Generic Web",
    "description": "Generic transcoding preset for: Facebook, SmugMug, Vimeo, YouTube",
    "size": "1280x720",
    "frame_rate": 30,
    "video_bitrate": "2200k",
    "audio_bitrate": "160k",
    "video_codec": "libx264",
    "audio_codec": "libfdk_aac",
    "video_codec_options": "MaxReferenceFrames:3,Profile:main,Level:3.1"
}
